A1: 边境语言-Stage10
A11: Stage10为专门为狗狗设计的语言，没有语序，更没有主谓宾。指令语：狗狗和人员共同的语言，建议不要使用本国语言，避免人类交流时触发关键词，让狗狗产生疑惑。狗狗语：8个词语为一组，用不同颜色区分。狗狗通过按不同的按键，向主人提出要求。人类语：需要明确以是或不是为答案的提问句，没有主语，默认主语是狗狗。可以试用狗狗语中的词汇。
A21: 指令语 | B21: 指令语：
B22: 序号 | C22: 英文 | D22: 中文 | E22: 法文 | F22: 俄文 | G22: 阿拉伯 | H22: 西班牙 | I22: 日文 | J22: 韩文 | K22: 越文 | L22: 蒙文
B24: =ROW()-23 -> 1 | C24: Sit‌ | D24: 坐下 | E24: Asseyez-vous | F24: Садись | G24: اجلس | H24: Siéntate. | I24: 座れ | J24: 앉아 | K24: Ngồi xuống. | L24: ᠰᠤᠦᠬ
B25: =ROW()-23 -> 2 | C25: Down | D25: 趴下 | E25: Restez à terre | F25: Ложись | G25: انبطح | H25: Abajo. | I25: 伏せ | J25: 엎드려 | K25: Nằm xuống! | L25: ᠥᠨᠳᠥᠭᠯᠥᠬ
B26: =ROW()-23 -> 3 | C26: ‌Lie‌ | D26: 躺下 | E26: Allongez - vous | F26: Ложись. | G26: استلقى | H26: Acuéstate. | I26: 寝ろ | J26: 눕다 | K26: Nằm xuống. | L26: ᠪᠠᠶᠬ
B27: =ROW()-23 -> 4 | C27: Come | D27: 过来 | E27: Viens ici | F27: Иди сюда. | G27: تعال | H27: Ven aquí. | I27: 来て | J27: 이리 와 | K27: Lại đây. | L27: ᠥᠷᠵ ᠢᠷᠡᠬ
B28: =ROW()-23 -> 5 | C28: ‌Stay | D28: 待命 | E28: En attente | F28: Готовьтесь. | G28: على أهبة الاستعداد | H28: En espera | I28: 待って | J28: 대기 중 | K28: Chuẩn bị | L28: ᠪᠡᠯᠡᠨ ᠪᠠᠶᠬ
B29: =ROW()-23 -> 6 | C29: ‌Stand | D29: 站着 | E29: Debout | F29: Стоять! | G29: يقف | H29: De pie | I29: 立って | J29: 서다 | K29: Đứng | L29: ᠵᠣᠭᠰᠣᠦᠬ
B30: =ROW()-23 -> 7 | C30: Heel | D30: 跟着 | E30: Suivez | F30: За мной. | G30: متابعة | H30: Sigue | I30: ついて来い | J30: 따라가다 | K30: Theo dõi | L30: ᠬᠠᠮᠭᠠᠯᠵ ᠢᠳᠡᠬ
B31: =ROW()-23 -> 8 | C31: ‌Go‌ | D31: 走吧 | E31: Allez - y. | F31: Пошли. | G31: هيا بنا | H31: Vamos, Vamos. | I31: 行こう | J31: 가자 | K31: Đi thôi. | L31: ᠶᠠᠪᠠᠬ ᠥᠭᠥᠳᠥ
B32: =ROW()-23 -> 9 | C32: Hand | D32: 握手 | E32: Poignée de main | F32: Рукопожатие | G32: مصافحة | H32: Estrechar la mano | I32: 握手して | J32: 악수 | K32: Bắt tay | L32: ᠬᠠᠨᠳᠯᠠᠭᠠ ᠬᠤᠸᠠᠬ
B33: =ROW()-23 -> 10 | C33: ‌Roll | D33: 打滚 | E33: Rouler | F33: Убирайся! | G33: تدحرجت | H33: Rodar | I33: 転がって | J33: 뒹굴다 | K33: Cuộn | L33: ᠲᠣᠶᠢᠷᠭᠯᠥᠬ
B34: =ROW()-23 -> 11 | C34: Quiet‌ | D34: 安静 | E34: Silence! | F34: Тише. | G34: هدوء | H34: Tranquilo | I34: 静かに | J34: 조용하다 | K34: Im lặng. | L34: ᠴᠥᠯᠥᠥᠯᠥᠬ ᠪᠠᠶᠬ
B35: =ROW()-23 -> 12 | C35: ‌No | D35: 不要 | E35: Ne pas | F35: не | G35: لا | H35: No | I35: だめ | J35: 하지 마 | K35: đừng | L35: ᠪᠤᠤᠬᠭᠦᠢ
A36: 狗狗语 | B36: 狗狗语：
B37: 家庭成员 | E37: 动作 | G37: 感情 | I37: 物品 | K37: 地点
B38: 序号 | C38: 英文 | D38: 中文 | E38: 英文 | F38: 中文 | G38: 英文 | H38: 中文 | I38: 英文 | J38: 中文 | K38: 英文 | L38: 中文
B40: =ROW()-39 -> 1 | C40: papa | D40: 爸爸 | E40: play | F40: 出去玩 | G40: like | H40: 喜欢 | I40: snack | J40: 零食 | K40: park | L40: 公园
B41: =ROW()-39 -> 2 | C41: mama | D41: 妈妈 | E41: Pooping | F41: 拉粑粑 | G41: hate | H41: 讨厌 | I41: water | J41: 水 | K41: downstairs | L41: 下楼
B42: =ROW()-39 -> 3 | C42: Son | D42: 儿子 | E42: Snacking | F42: 吃零食 | G42: love | H42: 爱 | I42: food | J42: 饭 | K42: school | L42: 学校
B43: =ROW()-39 -> 4 | C43: Daughter | D43: 女儿 | E43: Thirsty | F43: 口渴了 | G43: miss | H43: 想念 | I43: toy | J43: 玩具 | K43: post | L43: 驿站
B44: =ROW()-39 -> 5 | C44: grandpa | D44: 爷爷 | E44: discomfort | F44: 不舒服 | G44: eat | H44: 吃 | I44: bed | J44: 床 | K44: kindergarten | L44: 幼儿园
B45: =ROW()-39 -> 6 | C45: granny | D45: 奶奶 | E45: lost | F45: 找不到 | G45: drink | H45: 喝 | I45: leash | J45: 牵绳 | K45: store | L45: 杂货店
B46: =ROW()-39 -> 7 | C46: boy | D46: 男孩 | E46: yes | F46: 是 | G46: play | H46: 玩 | I46: broken | J46: 坏了 | K46: hospital | L46: 医院
B47: =ROW()-39 -> 8 | C47: girl | D47: 女孩 | E47: no | F47: 不是 | G47: happy | H47: 高兴 | I47: Nothing | J47: 没有了 | K47: restaurant | L47: 饭店
A48: 人类语 | B48: 人类语
B49: 序号 | C49: 英文 | D49: 中文 | E49: 法语 | F49: 俄语 | G49: 阿拉伯 | H49: 西班牙 | I49: 日文 | J49: 韩文 | K49: 越文 | L49: 蒙文
B51: =ROW()-50 -> 1 | C51: I | D51: 我 | E51: Je | F51: Я | G51: أنا | H51: Yo | I51: 私 | J51: 나 | K51: Tôi | L51: ᠨᠢᠨ
B52: =ROW()-50 -> 2 | C52: you | D52: 你 | E52: Tu | F52: Ты | G52: أنت | H52: Tú | I52: 君 | J52: 너 | K52: bạn | L52: ᠲᠡᠨ
B53: =ROW()-50 -> 3 | C53: he | D53: 他 | E53: Il | F53: Он | G53: هو . | H53: Él | I53: 彼 | J53: 그 | K53: anh ấy | L53: ᠬᠠᠨ
B54: =ROW()-50 -> 4 | C54: it | D54: 它 | E54: Elle | F54: Он | G54: هو | H54: Eso | I54: それ | J54: 그것 | K54: nó | L54: ᠦᠨᠳᠦ
B55: =ROW()-50 -> 5 | C55: father | D55: 父亲 | E55: Papa | F55: Папа | G55: أب | H55: Papá | I55: 父 | J55: 아빠 | K55: ba | L55: ᠡᠯᠲᠡᠨ
B56: =ROW()-50 -> 6 | C56: mather | D56: 母亲 | E56: Maman | F56: мама | G56: أم | H56: Madre | I56: 母 | J56: 엄마 | K56: Mẹ ơi | L56: ᠡᠮᠡᠨ
B57: =ROW()-50 -> 7 | C57: brother | D57: 兄弟 | E57: Frère | F57: Брат | G57: الاخوة | H57: hermano | I57: 兄弟 | J57: 형제 | K57: Đại ca. | L57: ᠭᠠᠵᠠ
B58: =ROW()-50 -> 8 | C58: sister | D58: 姐妹 | E58: Sœurs | F58: Сестры | G58: الأخوات | H58: Hermanas | I58: 姉妹 | J58: 자매 | K58: chị em | L58: ᠭᠠᠵᠠᠨ
B59: =ROW()-50 -> 9 | C59: boy | D59: 男孩 | E59: garçon | F59: мальчик | G59: ولد | H59: chico | I59: 少年 | J59: 소년 | K59: cậu bé
B60: =ROW()-50 -> 10 | C60: girl | D60: 女孩 | E60: fille | F60: девушка | G60: فتاة | H60: chica | I60: 少女 | J60: 소녀 | K60: cô gái
B61: =ROW()-50 -> 11 | C61: friend | D61: 朋友
B62: =ROW()-50 -> 12 | C62: baby | D62: 婴儿
B63: =ROW()-50 -> 13 | C63: cat | D63: 猫 | E63: chat | F63: Кот | G63: قطة | H63: gato | I63: 猫 | J63: 고양이 | K63: mèo
B64: =ROW()-50 -> 14 | C64: dog | D64: 狗 | E64: chien | F64: собака | G64: كلب | H64: perro | I64: 犬 | J64: 개 | K64: chó
A65: 常用语
B66: 1 | C66: Agreed! | D66: 我同意！ | E66: D'accord ! | F66: Согласен! | G66: موافقة! | H66: ¡De acuerdo! | I66: 同意します！ | J66: 동의합니다! | K66: Đồng ý!
B67: 2 | C67: Almost done. | D67: 快完成了。 | E67: Presque terminé. | F67: Почти готово. | G67: تقريبا انتهى | H67: Casi terminado. | I67: もうすぐ完成します。 | J67: 거의 다 됐어요. | K67: Gần xong rồi.
B68: 3 | C68: Are you cold?Not a bit. | D68: 你冷吗？一点都不。 | E68: Tu as froid ? Pas un peu. | F68: Тебе холодно? Ничего. | G68: هل أنت بارد؟ ليس قليلاً | H68: ¿Tienes frío? Ni un poco. | I68: 寒いですか。全然。 | J68: 추워요?전혀. | K68: Anh có lạnh không? Không một chút.
B69: 4 | C69: Are you free? | D69: 你有空吗？ | E69: Vous êtes libre ? | F69: Ты свободен? | G69: هل أنت حرة؟ | H69: ¿Estás libre? | I69: お暇ですか。 | J69: 시간 있어요? | K69: Anh có tự do không?
B70: 5 | C70: Be right back. | D70: 马上回来。 | E70: Je reviens tout de suite. | F70: Сразу вернусь. | G70: سأعود فوراً | H70: Ya vuelvo. | I70: すぐ戻ります。 | J70: 금방 올게. | K70: Mình sẽ quay lại ngay.
B71: 6 | C71: Can you cover me? | D71: 你能替代我吗？ | E71: Tu peux me couvrir ? | F71: Ты можешь меня покрыть? | G71: هل يمكنك تغطيتي؟ | H71: ¿Puedes cubrirme? | I71: 私の代わりになってくれませんか。 | J71: 당신은 나를 대신할 수 있습니까? | K71: Anh bảo vệ tôi được không?
B72: 7 | C72: Come in please, can I help you? | D72: 请进,请问您需要什么？ | E72: Entrez, je peux vous aider ? | F72: Заходи, пожалуйста, могу ли я помочь? | G72: ادخل من فضلك، هل يمكنني مساعدتك؟ | H72: Ven por favor, ¿puedo ayudarte? | I72: お入りください。何が必要ですか。 | J72: 어서 오세요. 뭘 드시겠어요? | K72: Xin vào, tôi giúp được không?
B73: 8 | C73: Come on, you can do it. | D73: 来吧，你能行。 | E73: Allez, vous pouvez le faire. | F73: Давай, ты сможешь это сделать. | G73: هيا، يمكنك القيام بذلك. | H73: Vamos, puedes hacerlo. | I73: さあ、あなたはできます。 | J73: 어서, 할 수 있어. | K73: Thôi nào, anh có thể làm được.
B74: 9 | C74: Come on，Cheer up | D74: 得了，振作起来 | E74: Allez, encouragez-vous. | F74: Давай, подняйся. | G74: هيا، تشجع | H74: Vamos, anima. | I74: もういい、元気を出して | J74: 됐어, 정신 차려 | K74: Thôi nào, vui lên.
B75: 10 | C75: Could you hurry? | D75: 你能快点吗? | E75: Tu peux te dépêcher ? | F75: Можешь поспешиться? | G75: هل يمكنك أن تسرع؟ | H75: ¿Podrías apresurarte? | I75: 早くしてくれませんか。 | J75: 빨리 좀 해줄래? | K75: Anh có thể nhanh không?
B76: 11 | C76: Count me in./I'm in. | D76: 算我一个。 | E76: Compte-moi en compte. | F76: Считай меня. | G76: احسبني | H76: Cuenta conmigo. | I76: 私を入れて。 | J76: 나도 끼워줘. | K76: Đếm tôi vào.
B77: 12 | C77: Count me out./I'm out. | D77: 不要算上我。 | E77: Compte-moi. | F77: Считай меня. | G77: احسبني | H77: Cuenta con mí. | I77: 私を入れないで。 | J77: 나 빼고 | K77: Đếm tôi ra.
B78: 13 | C78: Darn/Damn it | D78: 见鬼！ | E78: Putain ! | F78: Черт возьми | G78: لعنة | H78: Maldición / Maldición | I78: くそ！ | J78: 빌어 먹어요 | K78: Chết tiệt
B79: 14 | C79: Did I get you right? | D79: 我听对了吗？ | E79: Je t'ai bien compris ? | F79: Я понял тебя правильно? | G79: هل فهمتك بشكل صحيح؟ | H79: ¿Te entendí bien? | I79: 私は正しいですか。 | J79: 잘 들었나요? | K79: Tôi hiểu đúng không?
B80: 15 | C80: Do you have a menu? | D80: 服务员，有菜单吗？ | E80: Vous avez un menu ? | F80: У вас есть меню? | G80: هل لديك قائمة؟ | H80: ¿Tienes un menú? | I80: ウェイター、メニューはありますか。 | J80: 종업원, 메뉴 있어요? | K80: Anh có menu không?
B81: 16 | C81: Don't be silly. | D81: 别犯傻啦/别说傻话。 | E81: Ne sois pas stupide. | F81: Не будьте глупы. | G81: لا تكوني سخيفة | H81: No seas tonto. | I81: ばかなことを言うな。 | J81: 바보 같은 소리 하지 마라. | K81: Đừng ngu ngốc.
B82: 17 | C82: Don't bother me! | D82: 别烦我！ | E82: Ne me dérangez pas ! | F82: Не беспокой меня! | G82: لا تزعجني! | H82: ¡No me molestes! | I82: ほっといて！ | J82: 나를 귀찮게 굴지 마. | K82: Đừng làm phiền tôi!
B83: 18 | C83: Don't take it to heart. | D83: 别往心里去。 | E83: Ne le prenez pas au cœur. | F83: Не бери это к сердцу. | G83: لا تأخذها إلى القلب. | H83: No lo tome en serio. | I83: 気にしないで。 | J83: 마음에 두지 마라. | K83: Đừng để trái tim.
B84: 19 | C84: Dumb-ass! | D84: 蠢蛋！ | E84: Bastarde ! | F84: Глупак! | G84: أحمق! | H84: ¡Estúpido! | I84: バカ！ | J84: 멍청아! | K84: Đồ ngốc!
B85: 20 | C85: Excuse me | D85: 打搅一下 | E85: Excusez-moi. | F85: Извините меня. | G85: معذرة | H85: Disculpen. | I85: お邪魔します | J85: 실례합니다 | K85: Xin lỗi.
B86: 22 | C86: For real? | D86: 真的么？ | E86: Vraiment ? | F86: На самом деле? | G86: حقاً؟ | H86: ¿De verdad? | I86: 本当ですか。 | J86: 정말요? | K86: Thật sao?
B87: 23 | C87: Get in the car. | D87: 上车 | E87: Entrez dans la voiture. | F87: Садитесь в машину. | G87: ادخل السيارة | H87: Sube al coche. | I87: 乗る | J87: 승차 | K87: Nhập xe đi.
B88: 24 | C88: Get out! | D88: 少来了/少扯了！ | E88: Sortez ! | F88: Убирайся! | G88: أخرجي! | H88: ¡Sal de aquí! | I88: いらないよ/余計なことを言うな！ | J88: 작작 해라. | K88: Ra khỏi đây!
B89: 25 | C89: Go for it. | D89: 去做吧。 | E89: Allez-y. | F89: Иди на это. | G89: اذهبي لذلك. | H89: Ve por ello. | I89: やりましょう。 | J89: 가서 해. | K89: Đi thôi.
B90: 26 | C90: Good evening | D90: 晚上好 | E90: Bonsoir | F90: Добрый вечер | G90: مساء الخير | H90: Buenas noches. | I90: こんばんは | J90: 안녕하세요 | K90: Chào buổi tối
B91: 27 | C91: Good morning | D91: 早上好 | E91: Bonjour | F91: Доброе утро | G91: صباح الخير | H91: Buenos días | I91: おはようございます | J91: 좋은 아침 | K91: Chào buổi sáng.
B92: 28 | C92: Goodbye | D92: 再见 | E92: Au revoir | F92: До свидания | G92: وداعاً | H92: Adiós | I92: さようなら | J92: 안녕 | K92: Tạm biệt
B93: 29 | C93: Got it? | D93: 懂了吗？ | E93: Tu l'as compris ? | F93: Понимаешь? | G93: فهمت؟ | H93: ¿Lo entiendes? | I93: 分かりましたか？ | J93: 알겠어? | K93: Có hiểu không?
B94: 30 | C94: Gotta run. | D94: 得走了。 | E94: Il faut courir. | F94: Нужно бежать. | G94: عليّ الهروب. | H94: Tengo que correr. | I94: 行かなければなりません。 | J94: 가야겠다. | K94: Phải chạy.
B95: 31 | C95: Hello | D95: 你好 | E95: Bonjour | F95: Здравствуйте | G95: مرحبا | H95: Hola. Hola. | I95: こんにちは | J95: 안녕하세요 | K95: Xin chào
B96: 32 | C96: help yourself/make yourself at home | D96: 请便 | E96: faites-vous chez vous | F96: Сделайте себя дома | G96: ساعد نفسك | H96: Ayúdate a ti mismo | I96: どうぞ | J96: 마음대로 | K96: Làm cho mình ở nhà
B97: 33 | C97: How can you say that? | D97: 你怎么可以这么说？ | E97: Comment pouvez-vous dire ça ? | F97: Как ты можешь так сказать? | G97: كيف يمكنك أن تقول ذلك؟ | H97: ¿Cómo puedes decir eso? | I97: どうしてそんなことが言えるの？ | J97: 너는 어떻게 이렇게 말할 수 있니? | K97: Sao anh có thể nói thế?
B98: 34 | C98: How's it going? | D98: 最近怎么样？ | E98: Comment ça va ? | F98: Как дела? | G98: كيف حالك؟ | H98: ¿Cómo va? | I98: 最近はどうですか。 | J98: 요즘 어때요? | K98: Thế nào rồi?
B99: 35 | C99: Hurry up. | D99: 快点， | E99: Dépêche-toi. | F99: Быстрее! | G99: أسرع | H99: ¡Rápido! | I99: 急いで、 | J99: 어서, | K99: Nhanh lên.
B100: 36 | C100: I am running late. | D100: 我要迟到了。 | E100: Je suis en retard. | F100: Я опоздаю. | G100: أنا متأخر | H100: Estoy llegando tarde. | I100: 遅刻します。 | J100: 늦겠다. | K100: Tôi chạy muộn.
B101: 37 | C101: I blew it. | D101: 我搞砸了。 | E101: Je l'ai gâché. | F101: Я всё сорвал. | G101: لقد أفسدتها | H101: Lo arruiné. | I101: 私はしくじった。 | J101: 내가 망쳤어. | K101: Tôi đã làm hỏng nó.
B102: 38 | C102: I can't keep up with you， | D102: 我跟不上你的速度， | E102: Je ne peux pas te suivre, | F102: Я не могу идти в ногу с тобой, | G102: لا أستطيع مواكبتك | H102: No puedo mantenerme al día contigo, | I102: 私はあなたのスピードについていけません。 | J102: 나는 너의 속도를 따라가지 못하고, | K102: Tôi không thể theo kịp với bạn,
B103: 40 | C103: I couldn't care less. | D103: 我一点都不在乎。 | E103: Je ne peux pas m'en soucier moins. | F103: Мне не было меньше плевать. | G103: لم أكن أقل اهتماماً | H103: No me importaría menos. | I103: 私は少しも気にしない。 | J103: 나는 조금도 개의치 않는다. | K103: Tôi không thể quan tâm ít hơn.
B104: 41 | C104: I did what I could. | D104: 我已经尽力而为了。 | E104: J'ai fait ce que je pouvais. | F104: Я сделал, что мог. | G104: لقد فعلت ما أستطيع | H104: Hice lo que pude. | I104: 私は最善を尽くした。 | J104: 나는 이미 최선을 다했다. | K104: Tôi đã làm những gì tôi có thể.
B105: 42 | C105: I don't understand. | D105: 我不明白。 | E105: Je ne comprends pas. | F105: Я не понимаю. | G105: لا أفهم | H105: No lo entiendo. | I105: 私にはわかりません。 | J105: 이해가 안 돼. | K105: Tôi không hiểu.
B106: 43 | C106: I freaked out. | D106: 我超生气的。 | E106: J'ai fait peur. | F106: Я напугалась. | G106: لقد فزعت | H106: Me asusté. | I106: 私は超怒っています。 | J106: 나 완전 화났어. | K106: Tôi kinh hoàng.
B107: 44 | C107: I gotta run. | D107: 我得走了。 | E107: Je dois m'enfuir. | F107: Мне надо бежать. | G107: عليّ الهروب | H107: Tengo que correr. | I107: 私は行かなければなりません。 | J107: 나 가야 돼. | K107: Tôi phải chạy.
B108: 45 | C108: I gotta take off. | D108: 我得走了。 | E108: Je dois partir. | F108: Мне надо взлететь. | G108: يجب أن أقلع | H108: Tengo que despegarme. | I108: 私は行かなければなりません。 | J108: 나 가야 돼. | K108: Tôi phải cất cánh.
B109: 46 | C109: I hate his guts. | D109: 我太讨厌他了。 | E109: Je déteste ses entrailles. | F109: Ненавижу его желудка. | G109: أكره أمعائه | H109: Odio sus entrañas. | I109: 私は彼が大嫌いだ。 | J109: 나는 그가 너무 싫다. | K109: Tôi ghét ruột của hắn.
B110: 47 | C110: I lost my appetite. | D110: 我没胃口。 | E110: J'ai perdu mon appétit. | F110: Я потерял аппетит. | G110: لقد فقدت شهيتي | H110: Perdí mi apetito. | I110: 私は食欲がありません。 | J110: 입맛이 없어요. | K110: Tôi mất sự thèm ăn.
B111: 48 | C111: I nailed it. | D111: 我成功了。 | E111: Je l'ai cloué. | F111: Я его зашёл. | G111: لقد مسكرته. | H111: Lo clavé. | I111: 私は成功しました。 | J111: 나 성공했어. | K111: Tôi đã đóng đinh nó.
B112: 49 | C112: I need help. | D112: 我需要帮助。 | E112: J'ai besoin d'aide. | F112: Мне нужна помощь. | G112: أحتاج مساعدة | H112: Necesito ayuda. | I112: 助けが必要です。 | J112: 도움이 필요해요. | K112: Tôi cần giúp đỡ.
B113: 50 | C113: I screwed up. | D113: 我搞砸了。 | E113: J'ai foutu. | F113: Я испортил. | G113: لقد أفسدت | H113: Me arruiné. | I113: 私はしくじった。 | J113: 내가 망쳤어. | K113: Tôi làm hỏng rồi.
B114: 52 | C114: I want to take a rest. | D114: 我想休息一下。 | E114: Je veux me reposer. | F114: Я хочу отдохнуть. | G114: أريد أن أخذ استراحة | H114: Quiero descansar. | I114: ちょっと休みたいです。 | J114: 좀 쉬고 싶어요. | K114: Tôi muốn nghỉ ngơi
B115: 53 | C115: I will treat you. | D115: 我请客。 | E115: Je vais te traiter. | F115: Я тебя лечу. | G115: سأعالجك | H115: Te trataré. | I115: 私がおごります。 | J115: 제가 쏠게요. | K115: Ta sẽ chữa trị ngươi.
B116: 54 | C116: I'm hammered. | D116: 我喝醉了。 | E116: Je suis martelé. | F116: Мне ударили. | G116: أنا مطرقة. | H116: Estoy martillado. | I116: 私は酔っ払った。 | J116: 나 취했어. | K116: Tôi bị đập.
B117: 55 | C117: I'd better be going. | D117: 我应该走了。 | E117: Je ferais mieux d'y aller. | F117: Мне лучше идти. | G117: من الأفضل أن أذهب | H117: Será mejor que me vaya. | I117: もう行くべきだ。 | J117: 이만 가봐야겠어요. | K117: Tôi nên đi thôi.
B118: 56 | C118: I'll get it. | D118: 我去开门（门铃响或有人敲门时）。 | E118: Je vais l'obtenir. | F118: Я взму его. | G118: سأحصل عليه | H118: Yo lo conseguiré. | I118: 私はドアを開けに行きます（ドアのベルが鳴ったり、誰かがノックしたりしたとき）。 | J118: 나는 문을 열러 간다. | K118: Tôi sẽ lấy nó.
B119: 57 | C119: I'll pass. | D119: 我就不参加了/我就不要了。 | E119: Je vais passer. | F119: Я пройду. | G119: سأمر | H119: Voy a pasar. | I119: 私は参加しません。 | J119: 나는 참가하지 않을 것이다. | K119: Tôi sẽ đi qua.
B120: 58 | C120: I'll take care of it. | D120: 我会处理的。 | E120: Je m'en occuperai. | F120: Я позабочусь об этом. | G120: سأعتني بذلك | H120: Yo me encargaré de ello. | I120: 私は処理します。 | J120: 제가 처리하겠습니다. | K120: Tôi sẽ chăm sóc nó.
B121: 59 | C121: I'll take it. | D121: 我接受任务/我来处理。 | E121: Je vais le prendre. | F121: Я возьму. | G121: سآخذها | H121: Yo lo tomaré. | I121: 私は任務を受けます/私は処理します。 | J121: 나는 임무를 받아들인다. | K121: Tôi sẽ nhận nó.
B122: 60 | C122: I'm a tourist. | D122: 我是游客， | E122: Je suis touriste. | F122: Я турист. | G122: أنا سياح | H122: Soy un turista. | I122: 私は観光客ですが、 | J122: 나는 관광객, | K122: Tôi là du khách.
B123: 62 | C123: I'm fine. | D123: 我很好。 | E123: Je vais bien. | F123: Я в порядке. | G123: -أنا بخير | H123: - Estoy bien. | I123: 私は元気です。 | J123: 난 괜찮아. | K123: Tôi ổn rồi.
B124: 63 | C124: I'm good to go. | D124: 我准备好可以走了。 | E124: Je peux partir. | F124: Я готов идти. | G124: أنا على استعداد للذهاب | H124: Estoy bien para ir. | I124: 私は行く準備ができている。 | J124: 나는 갈 준비가 다 되었다. | K124: Tôi có thể đi.
B125: 64 | C125: I'm hungry. | D125: 我饿了。 | E125: J'ai faim. | F125: Я голодная. | G125: أنا جائع | H125: Tengo hambre. | I125: お腹が空きました。 | J125: 배고파요. | K125: Tôi đói rồi.
B126: 65 | C126: I'm just saying. | D126: 我只是说说而已。 | E126: Je dis juste. | F126: Я просто говорю. | G126: أنا فقط أقول | H126: Sólo estoy diciendo. | I126: 私はただ言っただけです。 | J126: 그냥 해본 소리예요. | K126: Tôi chỉ nói thôi.
B127: 66 | C127: I'm lost. Can you help me? | D127: 我迷路了，你能帮我吗？ | E127: Je suis perdu. Tu peux m'aider ? | F127: Я потерялся. Ты можешь мне помочь? | G127: لقد ضاعت هل يمكنك مساعدتي؟ | H127: Estoy perdido. ¿Puedes ayudarme? | I127: 道に迷ったので、手伝ってくれませんか。 | J127: 길을 잃었는데 좀 도와주시겠어요? | K127: Tôi lạc rồi. Anh giúp tôi được không?
B128: 67 | C128: I'm not myself. | D128: 我烦透了。 | E128: Je ne suis pas moi-même. | F128: Я не сам собой. | G128: أنا لست نفسي | H128: No soy yo mismo. | I128: 私はうんざりしている。 | J128: 지겨워 죽겠어요. | K128: Tôi không phải chính mình.
B129: 68 | C129: I'm on it. | D129: 我正在处理。 | E129: J'y suis. | F129: Я на этом. | G129: أنا على ذلك. | H129: Estoy trabajando. | I129: 私は処理しています。 | J129: 처리 중입니다. | K129: Tôi đang làm.
B130: 69 | C130: I'm totally beat. | D130: 我筋疲力尽了。 | E130: Je suis totalement battu. | F130: Я полностью побит. | G130: لقد هزمت تماماً | H130: Estoy totalmente derrotado. | I130: 私は疲れ果てた。 | J130: 나는 기진맥진했다. | K130: Tôi hoàn toàn bị đánh bại.
B131: 70 | C131: It doesn't matter. | D131: 没关系。 | E131: Ça n'a pas d'importance. | F131: Это не имеет значения. | G131: لا يهم | H131: No importa. | I131: 大丈夫。 | J131: 괜찮아요. | K131: Không quan trọng.
B132: 71 | C132: It won't be too long. | D132: 很快就好/不会太久的。 | E132: Ce ne sera pas trop longtemps. | F132: Это не будет слишком долго. | G132: لن يستغرق الأمر وقتا طويلا | H132: No tardará mucho. | I132: すぐによくなる/長くはかかりません。 | J132: 금방 나을 거예요. | K132: Sẽ không lâu đâu.
B133: 72 | C133: It's about time. | D133: 是时候了（行动/做某事） | E133: Il est temps. | F133: Пришло время. | G133: لقد حان الوقت | H133: Ya es hora. | I133: 時だ（行動／する） | J133: 때가 됐다 (행동/어떤 일을 한다) | K133: Đã đến lúc rồi.
B134: 73 | C134: It's done. | D134: 搞定了。 | E134: C'est fini. | F134: Всё готово. | G134: لقد انتهى | H134: Ya está hecho. | I134: できました。 | J134: 됐어. | K134: Đã xong rồi.
B135: 74 | C135: It's not delicious. | D135: 不好吃。 | E135: C'est pas délicieux. | F135: Это не вкусно. | G135: إنها ليست لذيذة | H135: No es delicioso. | I135: おいしくありません。 | J135: 맛없어. | K135: Nó không ngon.
B136: 75 | C136: It's not worth it. | D136: 不值得。 | E136: Ça ne vaut pas la peine. | F136: Это не стоит этого. | G136: لا يستحق ذلك | H136: No vale la pena. | I136: 値しない。 | J136: 가치가 없다. | K136: Nó không đáng giá.
B137: 76 | C137: It's too hot. I'm thirsty. | D137: 天气太热了，我渴了。 | E137: Il fait trop chaud. J'ai soif. | F137: Слишком жарко. Я жажду. | G137: إنه حار جداً أنا عطش | H137: Hace demasiado calor. Tengo sed. | I137: 暑すぎて喉が渇いた。 | J137: 날씨가 너무 더워서 목이 말라요. | K137: Nó quá nóng. Tôi khát rồi.
B138: 77 | C138: It's up to you. | D138: 由你决定。 | E138: C'est à vous. | F138: Все зависит от тебя. | G138: الأمر يعتمد عليك | H138: Depende de ti. | I138: あなた次第です。 | J138: 니가 결정해. | K138: Tùy thuộc vào anh.
B139: 78 | C139: It's very kind of you! | D139: 你真好！ | E139: C'est très gentil de votre part ! | F139: Это очень мило с твоей стороны! | G139: إنه لطيف جداً منك! | H139: ¡Es muy amable de tu parte! | I139: あなたは本当にいいですね。 | J139: 너 참 좋구나! | K139: Anh rất tử tế!
B140: 79 | C140: I've got some trouble, | D140: 我遇到了一些麻烦， | E140: J'ai un problème. | F140: У меня проблемы. | G140: لدي بعض المشاكل | H140: Tengo problemas. | I140: 私はいくつかのトラブルに遭遇しました。 | J140: 문제가 좀 생겼는데, | K140: Tôi gặp rắc rối.
B141: 80 | C141: I've never seen it before. | D141: 我从来没见过。 | E141: Je ne l'ai jamais vu auparavant. | F141: Я никогда этого не видел. | G141: لم أره من قبل | H141: Nunca lo había visto antes. | I141: 私は見たことがありません。 | J141: 나는 여태껏 본 적이 없다. | K141: Tôi chưa bao giờ thấy nó trước đây.
B142: 81 | C142: Just one more thing. | D142: 还有一件事。 | E142: Une chose de plus. | F142: Еще одна вещь. | G142: شيء واحد فقط | H142: Sólo una cosa más. | I142: もう一つあります。 | J142: 그리고 하나 더. | K142: Một điều nữa.
B143: 82 | C143: Keep going. | D143: 继续。 | E143: Continuez. | F143: Продолжайте. | G143: استمر بالذهاب | H143: Sigue adelante. | I143: 続行します。 | J143: 계속해. | K143: Tiếp tục đi.
B144: 83 | C144: Keep it up! | D144: 再接再厉！ | E144: Continuez ! | F144: Продолжай! | G144: استمر! | H144: ¡Manténgalo! | I144: もっと頑張れ！ | J144: 더욱 분발해라! | K144: Tiếp tục đi!
B145: 84 | C145: Keep up the good work. | D145: 继续保持好的表现。 | E145: Continuez le bon travail. | F145: Продолжайте хорошую работу. | G145: استمر في العمل الجيد. | H145: Continúa con el buen trabajo. | I145: 引き続き良いパフォーマンスを維持します。 | J145: 계속 좋은 모습을 보이다. | K145: Tiếp tục công việc tốt.
B146: 85 | C146: Let's go downstairs and poop. | D146: 下楼拉臭臭 | E146: Allez en bas et faire la caca. | F146: Давайте спустимся вниз и качимся. | G146: دعونا نذهب للأسفل ونقذف | H146: Vamos a bajar y cacar. | I146: 下りると臭いがする | J146: 아래층으로 내려가 악취를 풍기다. | K146: Đi xuống và poop.
B147: 87 | C147: Let's go home | D147: 回家 | E147: On rentre chez nous. | F147: Пойдем домой. | G147: لنذهب للمنزل | H147: Vamos a casa. | I147: 家に帰る | J147: 집으로 돌아가다 | K147: Về nhà thôi.
B148: 88 | C148: Let's go out to play | D148: 出去玩 | E148: Sortons jouer. | F148: Пойдем поиграть. | G148: لنخرج للعب | H148: Vamos a jugar. | I148: 遊びに行く | J148: 놀러가다 | K148: Đi chơi thôi.
B149: 89 | C149: Let's go pee. | D149: 去尿尿 | E149: Allons faire pipi. | F149: Пойдем мочиться. | G149: دعونا نتبول. | H149: Vamos a orinar. | I149: おしっこを取る | J149: 오줌을 싸다 | K149: Đi tiểu thôi.
B150: 90 | C150: Let's lie down for a rest. | D150: 咱们躺下休息一会儿。 | E150: Allongons-nous nous reposer. | F150: Лежим отдохнуть. | G150: لنستلقي للراحة | H150: Vamos a descansar. | I150: 横になってしばらく休みましょう。 | J150: 우리 누워서 좀 쉬자. | K150: Hãy nằm xuống để nghỉ ngơi.
B151: 91 | C151: Long time no see. | D151: 好久不见。 | E151: Ça fait longtemps que je ne me vois pas. | F151: Давно не виделись. | G151: منذ فترة طويلة لم نرى | H151: Hace mucho que no nos vemos. | I151: お久しぶりです。 | J151: 오랜만이에요. | K151: Lâu rồi không thấy.
B152: 92 | C152: Look out! | D152: 小心！ | E152: Attention ! | F152: Остерегайтесь! | G152: انتبه! | H152: ¡Cuidado! | I152: 気をつけてください。 | J152: 조심해! | K152: Cẩn thận!
B153: 93 | C153: Make it quick. | D153: 快点说/快点。 | E153: Faites-le vite. | F153: Сделайте это быстро. | G153: اجعلها سريعة | H153: Hazlo rápido. | I153: 早く言え/早くしろ。 | J153: 빨리 말해요. | K153: Làm cho nó nhanh.
B154: 94 | C154: Maybe next time. | D154: 下次吧/下次再约吧。 | E154: Peut-être la prochaine fois. | F154: Может в следующий раз. | G154: ربما المرة القادمة | H154: Tal vez la próxima vez. | I154: また今度にしましょう。 | J154: 다음에 약속합시다. | K154: Có lẽ lần sau.
B155: 95 | C155: Nice to meet you. | D155: 很高兴认识你。 | E155: Ravi de vous rencontrer. | F155: Приятно познакомиться. | G155: سعيد بمقابلتك | H155: Encantado de conocerte. | I155: お会いできて嬉しいです。 | J155: 만나서 반갑습니다. | K155: Rất vui được gặp anh.
B156: 96 | C156: No biggie. | D156: 没事/没什么大不了的。 | E156: Pas grand. | F156: Ничего большего. | G156: لا شيء كبير. | H156: No es una gran cosa. | I156: 大したことない。 | J156: 별거 아니에요. | K156: Không lớn.
B157: 97 | C157: No funny stuff. | D157: 不要耍花招。 | E157: Pas de trucs drôles. | F157: Ничего смешного. | G157: لا شيء مضحك | H157: No hay cosas divertidas. | I157: 手管を弄するな。 | J157: 수작 부리지 마라. | K157: Không có chuyện buồn cười.
B158: 98 | C158: No shit?! | D158: 不是吧？！真的假的？！ | E158: Pas de merde?! | F158: Нет дерьма?! | G158: لا هراء؟! | H158: ¿No mierda? | I158: 違うでしょう？！マジかよ？！ | J158: 아니죠?!진짜?! | K158: Không quái?!
B159: 99 | C159: No way! | D159: 不可能！ | E159: Pas le cas ! | F159: Нет шансов! | G159: لا طريقة! | H159: ¡De ninguna manera! | I159: ありえない！ | J159: 말도 안 돼! | K159: Không thể nào!
B160: 100 | C160: No worries. | D160: 别担心。 | E160: Pas de soucis. | F160: Не беспокойся. | G160: لا تقلق | H160: No te preocupes. | I160: 心配しないで。 | J160: 걱정 마. | K160: Đừng lo.
B161: 101 | C161: Not yet. | D161: 还没呢。 | E161: Pas encore. | F161: Пока нет. | G161: ليس بعد | H161: Aún no. | I161: まだですよ。 | J161: 아직이야. | K161: Vẫn chưa.
B162: 102 | C162: Oh, that explains it. | D162: 原来是这样。 | E162: Oh, ça l'explique. | F162: О, это объясняет. | G162: هذا يفسر الأمر | H162: Eso lo explica. | I162: なるほど。 | J162: 그렇구나. | K162: Điều đó giải thích.
B163: 103 | C163: Open the door. | D163: 开门 | E163: Ouvrez la porte. | F163: Откройте дверь. | G163: افتح الباب | H163: Abre la puerta. | I163: ドアを開ける | J163: 문 열어 | K163: Mở cửa ra.
B164: 104 | C164: Put it on. | D164: 穿上它 | E164: Mets-le. | F164: Одехай. | G164: ضعيه | H164: Póngalo. | I164: それを着て | J164: 입어 | K164: Mặc đi.
B165: 105 | C165: Rain check. | D165: 下次再约吧。 | E165: Vérifier la pluie. | F165: Проверка дождя. | G165: فحص المطر. | H165: Comprueba de lluvia. | I165: また今度約束しましょう。 | J165: 다음에 약속하자. | K165: Kiểm tra mưa.
B166: 106 | C166: Right on! | D166: 太对了！ | E166: À droite ! | F166: Прямо! | G166: مباشرة! | H166: ¡A la derecha! | I166: よかった！ | J166: 그렇지! | K166: Đúng rồi!
B167: 107 | C167: Sit down,please. | D167: 请坐. | E167: Asseyez-vous s'il vous plaît. | F167: Сядьте, пожалуйста. | G167: اجلسي من فضلك | H167: Siéntate, por favor. | I167: どうぞおかけください. | J167: 앉으세요. | K167: Xin ngồi xuống.
B168: 108 | C168: Slow down,I can't keep up. | D168: 慢点,我跟不上了。 | E168: Ralente, je ne peux pas suivre. | F168: Медленно, я не могу идти в ногу. | G168: أبطأ، لا أستطيع مواكبة. | H168: Despacio, no puedo seguir el ritmo. | I168: ゆっくりして、私はついていけません。 | J168: 천천히, 못 따라가겠어. | K168: Chậm lại, tôi không thể theo kịp được.
B169: 109 | C169: Sorry to bother you. | D169: 打扰了。 | E169: Désolé de vous déranger. | F169: Прости, что беспокою. | G169: آسفة لإزعاجك | H169: Disculpe molestarlo. | I169: お邪魔します。 | J169: 실례합니다. | K169: Xin lỗi vì làm phiền anh.
B170: 110 | C170: Sure thing. | D170: 当然了/没问题。 | E170: Bien sûr. | F170: Конечно. | G170: بالتأكيد. | H170: Por supuesto. | I170: もちろんです/大丈夫です。 | J170: 물론이죠. | K170: Chắc chắn.
B171: 111 | C171: Take care. | D171: 保重。 | E171: Prenez soin. | F171: Осторожно. | G171: احرص | H171: Cuidado. | I171: お大事に。 | J171: 잘 있어. | K171: Hãy cẩn thận.
B172: 112 | C172: Thank you (anyway). | D172: (不论如何)谢谢你。 | E172: Merci (de toute façon). | F172: Спасибо (в любом случае). | G172: شكراً (على أي حال). | H172: Gracias (de todos modos). | I172: ありがとう。 | J172: 감사합니다. | K172: Cảm ơn (dù sao).
B173: 113 | C173: Thank you very much. | D173: 非常感谢。 | E173: Merci beaucoup. | F173: Большое спасибо. | G173: شكراً جزيلاً | H173: Muchas gracias. | I173: どうもありがとうございました。 | J173: 정말 감사합니다. | K173: Cảm ơn rất nhiều.
B174: 114 | C174: That’s a good one. | D174: 这个（笑话）不错 | E174: C'est une bonne. | F174: Это хороший. | G174: هذا واحد جيد. | H174: Eso es bueno. | I174: これはいいですね | J174: 이것 (농담) 괜찮다 | K174: Đó là một cái tốt.
B175: 115 | C175: That's not cool. | D175: 这样不好哦。 | E175: C'est pas cool. | F175: Это не круто. | G175: هذا ليس رائعاً | H175: Eso no es genial. | I175: これはよくありませんよ。 | J175: 이러면 안 되는데. | K175: Không tuyệt đâu.
B176: 116 | C176: The sun come up. | D176: 太阳升起。/太阳都晒到屁股了。 | E176: Le soleil se lève. | F176: Солнце встает. | G176: الشمس تشرق | H176: El sol surge. | I176: 日が昇る。日がお尻まで照りつけた。 | J176: 해가 뜨다.○ 햇볕이 엉덩이까지 내리쬐었다. | K176: Mặt trời mọc.
B177: 117 | C177: There you go again | D177: 你又犯老毛病了 | E177: Voilà que tu vas encore | F177: Вот ты снова | G177: هناك تذهب مرة أخرى | H177: Aquí vas de nuevo | I177: 君はまた持病を起こした | J177: 너 또 고질병이 생겼구나 | K177: Đó là bạn đi một lần nữa
B178: 118 | C178: There you go. | D178: 果然如此。 | E178: Voilà. | F178: Вот ты. | G178: ها هي. | H178: Aquí tienes. | I178: やはりそうだ。 | J178: 역시 그렇다. | K178: Cậu đi.
B179: 119 | C179: There's no hurry. | D179: 不着急哈。 | E179: Il n'y a pas de précipitation. | F179: Нет спешки. | G179: ليس هناك عجلة | H179: No hay prisa. | I179: 焦らないで。 | J179: 서두르지 마세요. | K179: Không có gì vội.
B180: 120 | C180: Things happen. | D180: 事情就是这样。 | E180: Des choses arrivent. | F180: Всё происходит. | G180: الأشياء تحدث | H180: Las cosas pasan. | I180: 事はこうだ。 | J180: 일이 이렇다. | K180: Mọi thứ xảy ra.
B181: 121 | C181: This is a no-brainer. | D181: 这是显而易见的。 | E181: C'est un no-brainer. | F181: Это безумный. | G181: هذا هو لا عقل. | H181: Esto es un no-brainer. | I181: これは明らかだ。 | J181: 이것은 명백한 것이다. | K181: Đây là một no-brainer.
B182: 122 | C182: This taste is very strange. | D182: 这个味道很奇怪。 | E182: Ce goût est très étrange. | F182: Этот вкус очень странный. | G182: هذا الطعم غريب جداً. | H182: Este sabor es muy extraño. | I182: この味はおかしい。 | J182: 이 냄새 이상해. | K182: Hương vị này rất kỳ lạ.
B183: 123 | C183: Time to eat. | D183: 吃饭了 | E183: Il est temps de manger. | F183: Время поесть. | G183: حان الوقت لتناول الطعام | H183: Es hora de comer. | I183: ご飯を食べました | J183: 밥 먹었어? | K183: Thời gian ăn.
B184: 125 | C184: Well-put! | D184: 说得好！ | E184: Bien mis ! | F184: Хорошо! | G184: وضع جيد! | H184: ¡Bien puesto! | I184: いいことを言う！ | J184: 잘했어! | K184: Tốt lắm!
B185: 126 | C185: We're cool. | D185: 我们没事/没什么。 | E185: On est cool. | F185: Мы в порядке. | G185: نحن على ما يرام | H185: Estamos bien. | I185: 私たちは大丈夫/別に。 | J185: 우리는 괜찮아요. | K185: Chúng ta ổn thôi.
B186: 127 | C186: What the hell/fuck?! | D186: 什么鬼？！搞什么？！ | E186: Qu'est-ce qu'il y a, merde ?! | F186: Что, черт возьми?! | G186: ماذا بحق الجحيم / اللعنة؟! | H186: ¿Qué demonios? | I186: なに？！何してるの？！ | J186: 뭐?!뭐야?! | K186: Cái quái gì vậy?!
B187: 128 | C187: What's going on? | D187: 发生了什么事？ | E187: Qu'est-ce qui se passe ? | F187: Что происходит? | G187: ماذا يجري ؟ | H187: ¿Qué está pasando? | I187: 何があったの？ | J187: 무슨 일이 있었죠? | K187: Chuyện gì đang xảy ra?
B188: 129 | C188: What's this? | D188: 这是什么东西？ | E188: C'est quoi ? | F188: Что это? ! | G188: ما هذا ؟ | H188: ¿Qué es esto? | I188: これは何ですか。 | J188: 이것은 무엇입니까? | K188: Cái gì vậy?
B189: 130 | C189: What's up? | D189: 最近怎么样？ | E189: Qu'est-ce qui se passe ? | F189: Что случилось? | G189: ما الأمر ؟ | H189: ¿Qué pasa? | I189: 最近はどうですか。 | J189: 요즘 어때요? | K189: Chuyện gì vậy?
B190: 133 | C190: Where were we? | D190: 我们之前说到哪了？ | E190: Où étions-nous ? | F190: Где мы были? | G190: أين كنا؟ | H190: ¿Dónde estábamos? | I190: 私たちは前にどこまで話しましたか。 | J190: 우리 어디까지 얘기했지? | K190: Chúng ta ở đâu?
B191: 134 | C191: you had it coming! | D191: 你自找的！你早料到了！ | E191: Tu l'avais venue ! | F191: Ты пришла! | G191: لقد كان قادماً! | H191: ¡Lo tenías viniendo! | I191: あなたは自分で探しています！君はとっくに予想していた！ | J191: 네가 자초한 거야!너는 진작 예상했어! | K191: Anh đã có nó đến!
B192: 135 | C192: You rock! | D192: 你牛逼啊！ | E192: Vous rock ! | F192: Ты рок! | G192: أنت الصخرة! | H192: ¡Usted roca! | I192: あなたはすごいですね。 | J192: 너 정말 대단하구나! | K192: Ngươi đá!
B193: 137 | C193: You sold me. | D193: 你说服了我。 | E193: Tu m'as vendu. | F193: Ты продал меня. | G193: لقد باعتني | H193: Me vendiste. | I193: あなたは私を説得した。 | J193: 네가 날 설득했어. | K193: Anh bán tôi.
B194: 138 | C194: You were saying? | D194: 你刚才在说什么？ | E194: Tu disais ? | F194: Ты говорил? | G194: كنت تقول؟ | H194: ¿Estabas diciendo? | I194: 何の話だ? | J194: 너 방금 무슨 말을 하고 있었니? | K194: Anh đang nói?
B195: 139 | C195: you/he/she deserve it. | D195: 活该！ | E195: vous le méritez. | F195: Вы / он / она заслуживает этого. | G195: أنت / هو / هي تستحق ذلك. | H195: Usted/ella se lo merece. | I195: ざま見ろ！ | J195: 싸다! | K195: Anh/cô ấy xứng đáng với nó.
B196: 140 | C196: You're speaking too fast. | D196: 你说的太快了。 | E196: Tu parles trop vite. | F196: Ты говоришь слишком быстро. | G196: أنت تتحدث بسرعة كبيرة | H196: Estás hablando demasiado rápido. | I196: 君の言うことは早すぎる。 | J196: 너는 말을 너무 빨리 한다. | K196: Anh nói quá nhanh.
B197: 141 | C197: You're welcome. | D197: 不客气。 | E197: Vous êtes la bienvenue. | F197: Добро пожаловать. | G197: أنت مرحب بك | H197: Usted es bienvenido. | I197: どういたしまして。 | J197: 천만에요. | K197: Anh được chào đón.